aiter/ops/triton/configs/conv/gfx1201-CONV3D-GENERAL-NDHWC.json
{
    "shapes": {
        "N=1,C=64,D=16,H=32,W=32,K=64,KD=5,KH=5,KW=5,sd=1,sh=1,sw=1,pd=2,ph=2,pw=2,dd=1,dh=1,dw=1": {
            "BLOCK_M": 64,
            "BLOCK_N": 128,
            "BLOCK_K": 64,
            "GROUP_SIZE_M": 4,
            "num_warps": 4,
            "num_stages": 1
        },
        "N=1,C=128,D=8,H=32,W=32,K=128,KD=5,KH=5,KW=5,sd=1,sh=1,sw=1,pd=2,ph=2,pw=2,dd=1,dh=1,dw=1": {
            "BLOCK_M": 128,
            "BLOCK_N": 128,
            "BLOCK_K": 32,
            "GROUP_SIZE_M": 8,
            "num_warps": 8,
            "num_stages": 1
        },
        "N=1,C=256,D=4,H=32,W=32,K=256,KD=5,KH=5,KW=5,sd=1,sh=1,sw=1,pd=2,ph=2,pw=2,dd=1,dh=1,dw=1": {
            "BLOCK_M": 64,
            "BLOCK_N": 256,
            "BLOCK_K": 64,
            "GROUP_SIZE_M": 8,
            "num_warps": 8,
            "num_stages": 1
        },
        "N=1,C=96,D=6,H=48,W=48,K=96,KD=5,KH=5,KW=5,sd=1,sh=1,sw=1,pd=2,ph=2,pw=2,dd=1,dh=1,dw=1": {
            "BLOCK_M": 64,
            "BLOCK_N": 128,
            "BLOCK_K": 64,
            "GROUP_SIZE_M": 4,
            "num_warps": 4,
            "num_stages": 1
        },
        "N=1,C=128,D=8,H=16,W=16,K=128,KD=7,KH=7,KW=7,sd=1,sh=1,sw=1,pd=3,ph=3,pw=3,dd=1,dh=1,dw=1": {
            "BLOCK_M": 64,
            "BLOCK_N": 128,
            "BLOCK_K": 64,
            "GROUP_SIZE_M": 4,
            "num_warps": 4,
            "num_stages": 1
        },
        "N=1,C=192,D=6,H=32,W=32,K=192,KD=5,KH=5,KW=5,sd=1,sh=1,sw=1,pd=2,ph=2,pw=2,dd=1,dh=1,dw=1": {
            "BLOCK_M": 64,
            "BLOCK_N": 256,
            "BLOCK_K": 64,
            "GROUP_SIZE_M": 8,
            "num_warps": 8,
            "num_stages": 1
        },
        "N=1,C=64,D=8,H=32,W=32,K=128,KD=1,KH=3,KW=3,sd=1,sh=1,sw=1,pd=0,ph=1,pw=1,dd=1,dh=1,dw=1": {
            "BLOCK_M": 64,
            "BLOCK_N": 128,
            "BLOCK_K": 64,
            "GROUP_SIZE_M": 8,
            "num_warps": 8,
            "num_stages": 1
        }
    },
    "any": {
        "BLOCK_M": 64,
        "BLOCK_N": 128,
        "BLOCK_K": 64,
        "GROUP_SIZE_M": 4,
        "num_warps": 4,
        "num_stages": 1
    }
}
