aiter/ops/triton/configs/conv/gfx1201-CONV3D-GENERAL.json
{
    "shapes": {
        "N=1,C=192,D=6,H=178,W=198,K=192,T=3,R=3,S=3,sd=1,sh=1,sw=1,pd=1,ph=1,pw=1,dd=1,dh=1,dw=1": {
            "BLOCK_M": 64,
            "BLOCK_N": 256,
            "BLOCK_K": 64,
            "GROUP_SIZE_M": 8,
            "num_warps": 8,
            "num_stages": 1
        },
        "N=1,C=384,D=3,H=46,W=51,K=384,T=3,R=3,S=3,sd=1,sh=1,sw=1,pd=1,ph=1,pw=1,dd=1,dh=1,dw=1": {
            "BLOCK_M": 64,
            "BLOCK_N": 128,
            "BLOCK_K": 64,
            "GROUP_SIZE_M": 8,
            "num_warps": 8,
            "num_stages": 1
        },
        "N=1,C=384,D=4,H=90,W=100,K=384,T=3,R=3,S=3,sd=1,sh=1,sw=1,pd=1,ph=1,pw=1,dd=1,dh=1,dw=1": {
            "BLOCK_M": 64,
            "BLOCK_N": 128,
            "BLOCK_K": 64,
            "GROUP_SIZE_M": 8,
            "num_warps": 8,
            "num_stages": 1
        },
        "N=1,C=96,D=6,H=354,W=394,K=96,T=3,R=3,S=3,sd=1,sh=1,sw=1,pd=1,ph=1,pw=1,dd=1,dh=1,dw=1": {
            "BLOCK_M": 128,
            "BLOCK_N": 128,
            "BLOCK_K": 32,
            "GROUP_SIZE_M": 8,
            "num_warps": 8,
            "num_stages": 1
        }
    },
    "M_LEQ_65536": {
        "BLOCK_M": 64,
        "BLOCK_N": 128,
        "BLOCK_K": 64,
        "GROUP_SIZE_M": 8,
        "num_warps": 8,
        "num_stages": 1
    },
    "any": {
        "BLOCK_M": 64,
        "BLOCK_N": 256,
        "BLOCK_K": 64,
        "GROUP_SIZE_M": 8,
        "num_warps": 8,
        "num_stages": 1
    }
}
