aiter/ops/triton/configs/conv/gfx1201-CONV3D-1X1X1-NDHWC.json
{
    "shapes": {
        "N=1,C=256,D=16,H=32,W=32,K=512,KD=1,KH=1,KW=1,sd=1,sh=1,sw=1,pd=0,ph=0,pw=0,dd=1,dh=1,dw=1": {
            "BLOCK_M": 64,
            "BLOCK_N": 128,
            "BLOCK_K": 64,
            "GROUP_SIZE_M": 8,
            "num_warps": 4,
            "num_stages": 1
        },
        "N=1,C=512,D=8,H=64,W=64,K=512,KD=1,KH=1,KW=1,sd=1,sh=1,sw=1,pd=0,ph=0,pw=0,dd=1,dh=1,dw=1": {
            "BLOCK_M": 64,
            "BLOCK_N": 128,
            "BLOCK_K": 64,
            "GROUP_SIZE_M": 8,
            "num_warps": 4,
            "num_stages": 1
        },
        "N=1,C=384,D=3,H=46,W=51,K=384,KD=1,KH=1,KW=1,sd=1,sh=1,sw=1,pd=0,ph=0,pw=0,dd=1,dh=1,dw=1": {
            "BLOCK_M": 64,
            "BLOCK_N": 128,
            "BLOCK_K": 64,
            "GROUP_SIZE_M": 8,
            "num_warps": 4,
            "num_stages": 1
        },
        "N=1,C=128,D=16,H=64,W=64,K=256,KD=1,KH=1,KW=1,sd=1,sh=1,sw=1,pd=0,ph=0,pw=0,dd=1,dh=1,dw=1": {
            "BLOCK_M": 64,
            "BLOCK_N": 128,
            "BLOCK_K": 64,
            "GROUP_SIZE_M": 8,
            "num_warps": 4,
            "num_stages": 1
        }
    },
    "any": {
        "BLOCK_M": 64,
        "BLOCK_N": 128,
        "BLOCK_K": 64,
        "GROUP_SIZE_M": 8,
        "num_warps": 4,
        "num_stages": 1
    }
}
